{
  "schema_version": 2,
  "profile_revision": "synthetic-qc-to-aipm-v1",
  "campus_policy": "auto",
  "experience_allowlist": [
    "经验不限",
    "1-3年"
  ],
  "classify": [
    {
      "dir": "AI产品经理",
      "when": {
        "all": [
          {
            "field": "title",
            "match": "产品经理"
          },
          {
            "field": "title_skills",
            "match": "AI|人工智能|大模型|Agent",
            "flags": "i"
          }
        ]
      }
    }
  ],
  "exclude": [
    {
      "id": "degree-limit",
      "when": {
        "field": "degree",
        "in": [
          "硕士",
          "博士"
        ]
      },
      "reason": "当前画像未提供该学历资格，需按明确要求核实"
    },
    {
      "id": "experience-limit",
      "when": {
        "all": [
          {
            "not": {
              "field": "exp",
              "in": [
                "经验不限",
                "1-3年"
              ]
            }
          },
          {
            "not": {
              "field": "exp",
              "in": [
                "在校生",
                "应届生",
                "在校/应届"
              ]
            }
          }
        ]
      },
      "reason": "不在本次选择的经验范围内；校园标签由校园政策单独处理"
    }
  ],
  "score": {
    "AI产品经理": {
      "base": 60,
      "base_reason": "本次优先探索方向",
      "rules": [
        {
          "id": "agent-interest",
          "when": {
            "field": "title_skills",
            "match": "Agent|智能体",
            "flags": "i"
          },
          "add": 12,
          "reason": "符合用户的主题偏好；具体职责及编码要求待 JD 核实"
        }
      ]
    }
  },
  "global": [
    {
      "id": "preferred-city",
      "when": {
        "field": "city",
        "eq": "合肥"
      },
      "add": 3,
      "reason": "符合本次城市偏好"
    }
  ],
  "tiers": {
    "S": 90,
    "A": 75,
    "B": 60,
    "C": 40
  },
  "fallback_tier": "D"
}
